{"actions":{"payments.refund":{"consent":{"groups":[{"all":[{"quorum":1,"roles":["finance"]}]},{"all":[{"quorum":2,"roles":["finance"]}]}]},"exposed":false,"guards":["change_window"],"permission":"payments.refund","review":{"title":"Refund a payment"}},"repo.push":{"consent":"per_call","grantable":{"max_uses":3,"scope":"turn"},"messages":{"guard_false":{"user":"Pushes wait for the change window."}}},"repo.read":{}},"approver_roles":["finance","dev"],"limits":{"approval_ttl_ms":600000},"writ":"0.1"}
