{"writ":"0.1","approver_roles":["reviewer"],"limits":{"approval_ttl_ms":600000},"actions":{"deploy.prod":{"permission":"deploy","consent":{"quorum":1,"roles":["reviewer"],"exclude_requester":true},"approval_ttl_ms":172800000},"db.migrate":{"permission":"deploy","consent":{"quorum":2,"roles":["reviewer"],"exclude_requester":true},"approval_ttl_ms":172800000},"ticket.comment":{"consent":"per_call"}}}
